{
  "authority_boundary": "candidate admission grants no execution, disclosure, routing, mutation, merge, deployment, spending, credential, declassification, or approval authority",
  "candidate_id": "candidate://actor/a0dbf86e0a0b88c2faeb70366bb52e03ced68deb852427f906efdbd93622fa75",
  "candidate_provenance": [
    {"kind": "agent", "source_ref": "actor://synthetic/agent-b"},
    {"kind": "derivation", "source_ref": "fixture://synthetic/record-evolution/v1"}
  ],
  "candidate_record": {
    "artifact_refs": [],
    "lifecycle": "draft",
    "meaning": {"labels": ["synthetic", "corrected"], "summary": "Use the updated synthetic canonical profile."},
    "provenance": [{"kind": "author", "source_ref": "actor://synthetic/owner"}],
    "record_id": "record://synthetic/decision-0001",
    "record_type": "decision",
    "relationships": [{"target_ref": "record://synthetic/decision-0001", "target_revision_digest": "sha-256:5463997e6faa4945ed0fd8f1c8520ce91b861dd5bf2494e9d81f38952d3530c6", "type": "supersedes"}],
    "schema_id": "artifact-memory/knowledge-record/v3",
    "sensitivity": "public"
  },
  "candidate_revision_digest": "sha-256:a0dbf86e0a0b88c2faeb70366bb52e03ced68deb852427f906efdbd93622fa75",
  "owner_review_state": "required",
  "schema_id": "artifact-memory/knowledge-candidate/v1",
  "sensitivity": "public",
  "source_record_refs": [{"record_id": "record://synthetic/decision-0001", "revision_digest": "sha-256:5463997e6faa4945ed0fd8f1c8520ce91b861dd5bf2494e9d81f38952d3530c6"}]
}
